{
  "credentialId": "cred_hdip_passport_basic_001",
  "issuerId": "did:web:issuer.hdip.dev",
  "templateId": "hdip-passport-basic",
  "status": "active",
  "issuedAt": "2026-04-20T09:00:00Z",
  "expiresAt": "2027-04-20T09:00:00Z",
  "statusReference": "status:cred_hdip_passport_basic_001",
  "credentialArtifact": {
    "kind": "phase1_opaque_artifact",
    "mediaType": "application/vnd.hdip.phase1-opaque-artifact",
    "value": "opaque-artifact:v1:eyJjcmVkZW50aWFsSWQiOiJjcmVkX2hkaXBfcGFzc3BvcnRfYmFzaWNfMDAxIiwiaXNzdWVySWQiOiJkaWQ6d2ViOmlzc3Vlci5oZGlwLmRldiIsInRlbXBsYXRlSWQiOiJoZGlwLXBhc3Nwb3J0LWJhc2ljIiwiZXhwaXJlc0F0IjoiMjAyNy0wNC0yMFQwOTowMDowMFoifQ"
  }
}
